,dia,descricao
0,19/01/2022 17:00,"Reunião com ministro da Economia, Paulo Guedes. 
Local: Esplanada dos Ministérios - Brasília.Reunião com ministro da Economia, Paulo Guedes. Local: Esplanada dos Ministérios - Brasília."
1,18/01/2022 18:30,"Anúncio de investimento em unidades de saúde de Mesquita. 
Local: Câmara de Vereadores de Mesquita.Anúncio de investimento em unidades de saúde de Mesquita. Local: Câmara de Vereadores de Mesquita."
2,18/01/2022 11:00,"Lançamento do Programa Turismo Presente. 
Local: Palácio Guanabara - Rua Pinheiro Machado, s/n°, Laranjeiras, Rio de Janeiro.Lançamento do Programa Turismo Presente. Local: Palácio Guanabara - Rua Pinheiro Machado, s/n°, Laranjeiras, Rio de Janeiro."
3,17/01/2022 16:30,"Coletiva de imprensa - Regime de Recuperação Fiscal
Local: Salão Nobre do Palácio GuanabaraColetiva de imprensa - Regime de Recuperação FiscalLocal: Salão Nobre do Palácio Guanabara"
4,15/01/2022 15:30,"Visita a localidades afetadas pelas chuvas em Itaperuna. 
Local: Rua Manoel Custódio, 750.Visita a localidades afetadas pelas chuvas em Itaperuna. Local: Rua Manoel Custódio, 750."
5,15/01/2022 14:30,"Visita a localidades afetadas pelas chuvas em Cambuci. 
Local: Rua Capitão Júlio Velasco, 311.Visita a localidades afetadas pelas chuvas em Cambuci. Local: Rua Capitão Júlio Velasco, 311."
6,15/01/2022 11:00,"Visita a ações do Programa RJ para Todos em Campos dos Goytacazes. 
Local: Ciep 56 Custódio Siqueira - Avenida Senador José Carlos Pereira Pinto, Parque Alvorada - Campos.Visita a ações do Programa RJ para Todos em Campos dos Goytacazes. Local: Ciep 56 Custódio Siqueira - Avenida Senador José Carlos Pereira Pinto, Parque Alvorada - Campos."
7,15/01/2022 10:00,"Lançamento do Operação Segurança Presente em Campos dos Goytacazes. 
Local: Rua do Ouvidor, 174, Centro, próximo ao 8º BPM - Campos.Lançamento do Operação Segurança Presente em Campos dos Goytacazes. Local: Rua do Ouvidor, 174, Centro, próximo ao 8º BPM - Campos."
8,14/01/2022 11:00,"Ampliação da Operação Segurança Presente em Queimados.
Local: Praça do Eucalipto - Av. Prof. Avelino Xandão, s/nº - Vila do Tinguá, Queimados.Ampliação da Operação Segurança Presente em Queimados.Local: Praça do Eucalipto - Av. Prof. Avelino Xandão, s/nº - Vila do Tinguá, Queimados."
9,14/01/2022 09:00,"Inauguração da Operação Segurança Presente em Itaboraí.
Local: Rua Doutor Mendonça Sobrinho, 129 - Centro de Itaboraí.Inauguração da Operação Segurança Presente em Itaboraí.Local: Rua Doutor Mendonça Sobrinho, 129 - Centro de Itaboraí."
10,14/01/2022 08:00,Reunião com o prefeito de Miguel Pereira e empresários da cidade.Reunião com o prefeito de Miguel Pereira e empresários da cidade.
11,13/01/2022 14:30,"Abertura da Rio Innovation Week. 
Local: Jockey Club Brasileiro, Gávea, Rio de Janeiro.Abertura da Rio Innovation Week. Local: Jockey Club Brasileiro, Gávea, Rio de Janeiro."
12,13/01/2022 08:00,"Visita a áreas afetadas pelas chuvas em São João da Barra, no Norte Fluminense.Visita a áreas afetadas pelas chuvas em São João da Barra, no Norte Fluminense."
13,12/01/2022 16:00,"Reunião com o ministro da Infraestrutura, Tarcísio Freitas. 
Local: Esplanada dos Ministérios, bloco R, 6º andar, Brasília.Reunião com o ministro da Infraestrutura, Tarcísio Freitas. Local: Esplanada dos Ministérios, bloco R, 6º andar, Brasília."
14,12/01/2022 10:00,"Anúncio de evento no calendário esportivo do Rio de Janeiro. 
Local: Palácio Guanabara - Rua Pinheiro Machado, s/n°, Laranjeiras, Rio de Janeiro.Anúncio de evento no calendário esportivo do Rio de Janeiro. Local: Palácio Guanabara - Rua Pinheiro Machado, s/n°, Laranjeiras, Rio de Janeiro."
15,11/01/2022 09:00,"Despachos internos. 
Local: Palácio Guanabara - Rua Pinheiro Machado, s/n°, Laranjeiras, Rio de Janeiro.Despachos internos. Local: Palácio Guanabara - Rua Pinheiro Machado, s/n°, Laranjeiras, Rio de Janeiro."
16,10/01/2022 08:00,"Inauguração do Centro de Testagem para Covid-19 no Estádio de Atletismo Célio de Barros. 
Local: Estádio de Atletismo Célio de Barros, Maracanã, Portão 11.Inauguração do Centro de Testagem para Covid-19 no Estádio de Atletismo Célio de Barros. Local: Estádio de Atletismo Célio de Barros, Maracanã, Portão 11."
17,30/12/2021 09:00,Inauguração do Centro de Tratamento de Dependentes Químicos Fazenda ParaísoLocal:Rua Lair Silveira Amorim (em frente à Estrada do Tabuleiro) – Xerém – Duque de CaxiasLocal:Rua Lair Silveira Amorim (em frente à Estrada do Tabuleiro) – Xerém – Duque de Caxias
18,29/12/2021 14:00,"Leilão da segunda fase da concessão de saneamentoLocal: B3 (Bolsa de Valores de SP), Rua XV de novembro, 275 - Centro - SP"
19,29/12/2021 09:00,"Investimentos para implantação do sistema de esgotamento sanitário da Área de Planejamento 5 (AP-5)Local: Palácio Guanabara - Rua Pinheiro Machado, s/n°, Laranjeiras, Rio de Janeiro."
20,28/12/2021 09:00,"Despachos internos.Local: Palácio Guanabara - Rua Pinheiro Machado, s/n°, Laranjeiras, Rio de Janeiro.Local: Palácio Guanabara - Rua Pinheiro Machado, s/n°, Laranjeiras, Rio de Janeiro."
21,23/12/2021 09:00,"Despachos internos. 
Local: Palácio Guanabara - Rua Pinheiro Machado, s/n°, Laranjeiras, Rio de Janeiro.Despachos internos. Local: Palácio Guanabara - Rua Pinheiro Machado, s/n°, Laranjeiras, Rio de Janeiro."
22,22/12/2021 11:00,"Lançamento do plano de recuperação dos batalhões da Polícia Militar.
 Local: 4º BPM - Rua Francisco Eugênio, 228 - São Cristóvão, Rio de Janeiro.Lançamento do plano de recuperação dos batalhões da Polícia Militar. Local: 4º BPM - Rua Francisco Eugênio, 228 - São Cristóvão, Rio de Janeiro."
23,21/12/2021 18:30,"Posse dos novos procuradores do estado. 
Local: Theatro Municipal, Praça Marechal Floriano, s/nº, Centro do Rio.Posse dos novos procuradores do estado. Local: Theatro Municipal, Praça Marechal Floriano, s/nº, Centro do Rio."
24,20/12/2021 09:00,"Despachos internos. 
Local: Palácio Guanabara - Rua Pinheiro Machado, s/n°, Laranjeiras, Rio de Janeiro.Despachos internos. Local: Palácio Guanabara - Rua Pinheiro Machado, s/n°, Laranjeiras, Rio de Janeiro."
25,17/12/2021 10:30,"Audiência Pública sobre o Projeto de Requalificação Urbanística da Mangueira. 
Local: Quadra da Estação Primeira de Mangueira - Rua Visconde de Niterói, 1.072.Audiência Pública sobre o Projeto de Requalificação Urbanística da Mangueira. Local: Quadra da Estação Primeira de Mangueira - Rua Visconde de Niterói, 1.072."
26,16/12/2021 09:00,"Entrega de viaturas para a Polícia Civil e assinatura de cooperação entre as secretarias de Polícia Civil e de Esportes.
Local: Acadepol – Rua Frei Caneca, 163, Centro do Rio.Entrega de viaturas para a Polícia Civil e assinatura de cooperação entre as secretarias de Polícia Civil e de Esportes.Local: Acadepol – Rua Frei Caneca, 163, Centro do Rio."
27,15/12/2021 12:00,"Almoço ""Líderes do Ano"", promovido pelo Grupo de Líderes Empresariais (Lide). 
Local: Hotel Fairmont, na Avenida Atlântica, 4.240 - Copacabana.Almoço ""Líderes do Ano"", promovido pelo Grupo de Líderes Empresariais (Lide). Local: Hotel Fairmont, na Avenida Atlântica, 4.240 - Copacabana."
28,15/12/2021 10:00,"Anúncio do retorno da Stock Car ao Rio de Janeiro. 
Local: Palácio Guanabara – Rua Pinheiro Machado, s/n°– Laranjeiras, Rio de Janeiro.Anúncio do retorno da Stock Car ao Rio de Janeiro. Local: Palácio Guanabara – Rua Pinheiro Machado, s/n°– Laranjeiras, Rio de Janeiro."
29,15/12/2021 08:30,"Café da manhã com jornalistas.
 Local: Palácio Guanabara – Rua Pinheiro Machado, s/n°– Laranjeiras, Rio de Janeiro.Café da manhã com jornalistas. Local: Palácio Guanabara – Rua Pinheiro Machado, s/n°– Laranjeiras, Rio de Janeiro."
30,14/12/2021 14:30,"Lançamento do aplicativo Mais Trabalho RJ. 
Local: Palácio Guanabara – Rua Pinheiro Machado, s/n°– Laranjeiras, Rio de Janeiro.Lançamento do aplicativo Mais Trabalho RJ. Local: Palácio Guanabara – Rua Pinheiro Machado, s/n°– Laranjeiras, Rio de Janeiro."
31,14/12/2021 09:00,"Reunião com o secretariado. 
Local: Centro de Convenções SulAmérica, na Avenida Paulo de Frontin, 1, Estácio.Reunião com o secretariado. Local: Centro de Convenções SulAmérica, na Avenida Paulo de Frontin, 1, Estácio."
32,13/12/2021 20:00,"Inauguração de unidade do Corpo de Bombeiros na Cidade do Samba. 
Local: Cidade do Samba, na Rua Rivadávia Correia, 60, Gamboa, Rio de Janeiro.Inauguração de unidade do Corpo de Bombeiros na Cidade do Samba. Local: Cidade do Samba, na Rua Rivadávia Correia, 60, Gamboa, Rio de Janeiro."
33,13/12/2021 11:30,"Lançamento das câmeras operacionais portáteis. 
Local: Centro Integrado de Comando e Controle, na Rua Carmo Neto, s/nº, Cidade Nova, Rio de Janeiro.Lançamento das câmeras operacionais portáteis. Local: Centro Integrado de Comando e Controle, na Rua Carmo Neto, s/nº, Cidade Nova, Rio de Janeiro."
34,13/12/2021 10:00,"Cerimônias do Dia do Marinheiro e de Imposição da Medalha do Mérito Tamandaré. 
Local: Casa do Marinheiro - Av. Brasil, 10.592 - Penha.Cerimônias do Dia do Marinheiro e de Imposição da Medalha do Mérito Tamandaré. Local: Casa do Marinheiro - Av. Brasil, 10.592 - Penha."
35,13/12/2021 08:00,"Formatura de 400 novos soldados da Polícia Militar
Local: Centro de Formação e Aperfeiçoamento de Praças (Cfap) - Av. Marechal Fontenele, 2.906 - Jardim Sulacap.Formatura de 400 novos soldados da Polícia MilitarLocal: Centro de Formação e Aperfeiçoamento de Praças (Cfap) - Av. Marechal Fontenele, 2.906 - Jardim Sulacap."
36,11/12/2021 09:00,"Inauguração da primeira central de monitoramento do Programa Expresso Turístico. 
Local: Avenida Presidente João Goulart (Linha Vermelha), 135, Cidade Universitária, Rio de Janeiro.Inauguração da primeira central de monitoramento do Programa Expresso Turístico. Local: Avenida Presidente João Goulart (Linha Vermelha), 135, Cidade Universitária, Rio de Janeiro."
37,10/12/2021 15:00,"Entrega de 30 motolâncias para o Serviço de Atendimento Móvel de Urgência (Samu).
 Local: Palácio Guanabara – Rua Pinheiro Machado, s/n°– Laranjeiras, Rio de Janeiro.Entrega de 30 motolâncias para o Serviço de Atendimento Móvel de Urgência (Samu). Local: Palácio Guanabara – Rua Pinheiro Machado, s/n°– Laranjeiras, Rio de Janeiro."
38,10/12/2021 11:00,"Posse do desembargador Ziraldo Maia como membro titular da Corte Eleitoral do TRE-RJ. 
Local: Plenário do Órgão Especial do TJRJ, na Rua Dom Manuel, s/nº, Centro do Rio.Posse do desembargador Ziraldo Maia como membro titular da Corte Eleitoral do TRE-RJ. Local: Plenário do Órgão Especial do TJRJ, na Rua Dom Manuel, s/nº, Centro do Rio."
39,10/12/2021 10:00,"Posse do desembargador Paulo Wunder de Alencar no Tribunal de Justiça. 
Local: Plenário do Órgão Especial do TJRJ, na Rua Dom Manuel, s/nº, Centro do Rio.Posse do desembargador Paulo Wunder de Alencar no Tribunal de Justiça. Local: Plenário do Órgão Especial do TJRJ, na Rua Dom Manuel, s/nº, Centro do Rio."
40,09/12/2021 14:30,"Abertura da 11ª edição do Rio Gastronomia.
Local: Jockey Club Brasileiro, Praça Santos Dumont, 31, Gávea, Rio de Janeiro.Abertura da 11ª edição do Rio Gastronomia.Local: Jockey Club Brasileiro, Praça Santos Dumont, 31, Gávea, Rio de Janeiro."
41,09/12/2021 11:00,"Lançamento do Programa Bolsa Atleta RJ. 
Local: Palácio Guanabara – Rua Pinheiro Machado, s/n°– Laranjeiras, Rio de Janeiro.Lançamento do Programa Bolsa Atleta RJ. Local: Palácio Guanabara – Rua Pinheiro Machado, s/n°– Laranjeiras, Rio de Janeiro."
42,09/12/2021 08:30,"Abertura do II Encontro Brasileiro do Direito da Empresa. 
Local: Prodigy Santos Dumont - Avenida Almirante Silvio de Noronha, 365 - Centro do Rio.Abertura do II Encontro Brasileiro do Direito da Empresa. Local: Prodigy Santos Dumont - Avenida Almirante Silvio de Noronha, 365 - Centro do Rio."
43,08/12/2021 11:30,"Ordem de início da retomada das obras do Museu da Imagem do Som em Copacabana. 
Local: Av. Atlântica, 3.432 – Copacabana, Rio de Janeiro.Ordem de início da retomada das obras do Museu da Imagem do Som em Copacabana. Local: Av. Atlântica, 3.432 – Copacabana, Rio de Janeiro."
44,08/12/2021 10:00,"Entrega do Colar do Mérito Judiciário do Tribunal de Justiça. 
Local: Tribunal de Justiça do Rio – Fórum Central - Rua Dom Manuel, 37 – Centro.Entrega do Colar do Mérito Judiciário do Tribunal de Justiça. Local: Tribunal de Justiça do Rio – Fórum Central - Rua Dom Manuel, 37 – Centro."
45,07/12/2021 12:00,"Evento ""Almoço do Empresário"", da Associação Comercial do Rio de Janeiro. 
Local: Associação Comercial do Rio de Janeiro - Rua Candelária, 9, Centro do Rio.Evento ""Almoço do Empresário"", da Associação Comercial do Rio de Janeiro. Local: Associação Comercial do Rio de Janeiro - Rua Candelária, 9, Centro do Rio."
46,07/12/2021 09:00,"GRI Rio Summit 2021 
Local: Fairmont Copacabana - Av. Atlântica, 4.240 - Copacabana, Rio.GRI Rio Summit 2021 Local: Fairmont Copacabana - Av. Atlântica, 4.240 - Copacabana, Rio."
47,06/12/2021 09:00,"Despachos internos. 
Local: Palácio Guanabara - Rua Pinheiro Machado, s/n°, Laranjeiras, Rio de Janeiro.Despachos internos. Local: Palácio Guanabara - Rua Pinheiro Machado, s/n°, Laranjeiras, Rio de Janeiro."
48,03/12/2021 09:00,"Despachos internos. 
Local: Palácio Guanabara - Rua Pinheiro Machado, s/n°, Laranjeiras, Rio de Janeiro.Despachos internos. Local: Palácio Guanabara - Rua Pinheiro Machado, s/n°, Laranjeiras, Rio de Janeiro."
49,02/12/2021 09:00,"Despachos internos.
 Local: Palácio Guanabara - Rua Pinheiro Machado, s/n°, Laranjeiras, Rio de Janeiro.Despachos internos. Local: Palácio Guanabara - Rua Pinheiro Machado, s/n°, Laranjeiras, Rio de Janeiro."
50,01/12/2021 15:00,"Assinatura do decreto de redução de ICMS para as áreas de comunidades. 
Local: Palácio Guanabara - Rua Pinheiro Machado, s/n°, Laranjeiras, Rio de Janeiro.Assinatura do decreto de redução de ICMS para as áreas de comunidades. Local: Palácio Guanabara - Rua Pinheiro Machado, s/n°, Laranjeiras, Rio de Janeiro."
51,01/12/2021 11:00,"Homenagem aos policiais civis que integram a Força-Tarefa de Combate às Milícias. 
Local: Cidade da Polícia, na Avenida Dom Hélder Câmara, 2.066, Jacarezinho, Rio de Janeiro.Homenagem aos policiais civis que integram a Força-Tarefa de Combate às Milícias. Local: Cidade da Polícia, na Avenida Dom Hélder Câmara, 2.066, Jacarezinho, Rio de Janeiro."
52,01/12/2021 09:00,"I Encontro de Rádios do Estado do Rio. 
Local: Palácio Guanabara - Rua Pinheiro Machado, s/n°, Laranjeiras, Rio de Janeiro.I Encontro de Rádios do Estado do Rio. Local: Palácio Guanabara - Rua Pinheiro Machado, s/n°, Laranjeiras, Rio de Janeiro."
53,30/11/2021 09:00,Agendas em Brasília.Agendas em Brasília.
54,29/11/2021 15:00,"Lançamento do programa M.A.ELocal: Auditório da Universidade do Estado do Rio de Janeiro (Uerj) - Rua São Francisco Xavier, 524 - Maracanã"
55,29/11/2021 11:00,Entrevista sobre calendário de pagamento dos servidores e pensionistasLocal: Palácio Guanabara
56,29/11/2021 09:00,"Visita ao início das obras do Hospital Geral em CamposLocal: Avenida José Alvares de Azevedo, 337, Parque Rosário - Campos"
57,26/11/2021 10:00,"Homenagem aos 90 anos do Cristo Redentor feita pelo Senado Federal. 
Local: Gabinete no Palácio Guanabara (videoconferência).Homenagem aos 90 anos do Cristo Redentor feita pelo Senado Federal. Local: Gabinete no Palácio Guanabara (videoconferência)."
58,26/11/2021 09:00,"I Fórum de Políticas Públicas promovido pela Arquidiocese do Rio de Janeiro. 
Local: Gabinete no Palácio Guanabara (videoconferência).I Fórum de Políticas Públicas promovido pela Arquidiocese do Rio de Janeiro. Local: Gabinete no Palácio Guanabara (videoconferência)."
59,25/11/2021 15:00,"Entrega dos projetos da Lei Orgânica da Polícia Civil e do Sistema de Proteção Legal dos Militares.
Local: Alerj, à Rua Primeiro de Março, s/n° - Centro do Rio.Entrega dos projetos da Lei Orgânica da Polícia Civil e do Sistema de Proteção Legal dos Militares.Local: Alerj, à Rua Primeiro de Março, s/n° - Centro do Rio."
60,24/11/2021 10:00,"Lançamento da Conferência Rio2030. 
Local: Marina da Glória, Rio de Janeiro.Lançamento da Conferência Rio2030. Local: Marina da Glória, Rio de Janeiro."
61,23/11/2021 09:00,"Despachos internos. 
Local: Palácio Guanabara - Rua Pinheiro Machado, s/n°, Laranjeiras, Rio de Janeiro.Despachos internos. Local: Palácio Guanabara - Rua Pinheiro Machado, s/n°, Laranjeiras, Rio de Janeiro."
62,19/11/2021 11:30,"Posse dos novos presidentes da Ademi e do Sinduscom. 
Local: Hotel Fairmont – Av. Atlântica, 4.240 - Copacabana, Rio de Janeiro.Posse dos novos presidentes da Ademi e do Sinduscom. Local: Hotel Fairmont – Av. Atlântica, 4.240 - Copacabana, Rio de Janeiro."
63,18/11/2021 12:00,"Despachos internos. 
Local: Palácio Guanabara - Rua Pinheiro Machado, s/n°, Laranjeiras, Rio de Janeiro.Despachos internos. Local: Palácio Guanabara - Rua Pinheiro Machado, s/n°, Laranjeiras, Rio de Janeiro."
64,16/11/2021 09:00,"Participação na Smart City Expo World Congress (Fira Barcelona), às 9h (horário local)."
65,15/11/2021 17:00,"Encontro com empresários catalães na Câmara de Comércio Brasil-Catalunha, em Barcelona, às 17h (horário local).Encontro com empresários catalães na Câmara de Comércio Brasil-Catalunha, em Barcelona, às 17h (horário local)."
66,15/11/2021 11:00,"Reunião com o presidente mundial da Naturgy em Barcelona, na Espanha, às 11h (horário local).Reunião com o presidente mundial da Naturgy em Barcelona, na Espanha, às 11h (horário local)."
67,12/11/2021 16:00,"Visita à sede da empresa Poma, em Voreppe, na França, às 16h (horário local).Visita à sede da empresa Poma, em Voreppe, na França, às 16h (horário local)."
68,11/11/2021 17:00,"Reunião no Ministério da Cultura da Itália, às 17h (horário local).Reunião no Ministério da Cultura da Itália, às 17h (horário local)."
69,11/11/2021 11:00,"Visita ao Centro Aeroespacial Fucino de Telespazio, na Itália, às 11h (horário local).Visita ao Centro Aeroespacial Fucino de Telespazio, na Itália, às 11h (horário local)."
70,11/11/2021 09:00,"Anúncio de investimento das empresas TIM, Enel e Leonardo, em Roma, na Itália, às 9h (horário local).Anúncio de investimento das empresas TIM, Enel e Leonardo, em Roma, na Itália, às 9h (horário local)."
71,10/11/2021 18:00,"Reunião em Roma, na Itália, com a Agência Nacional de Turismo, às 18h (horário local).Reunião em Roma, na Itália, com a Agência Nacional de Turismo, às 18h (horário local)."
72,10/11/2021 15:30,"Visita à sede da Enel X em Roma, na Itália, às 15h30min (horário local).Visita à sede da Enel X em Roma, na Itália, às 15h30min (horário local)."
73,08/11/2021 09:00,"Despachos internos. 
Local: Palácio Guanabara - Rua Pinheiro Machado, s/n°, Laranjeiras, Rio de Janeiro.Despachos internos. Local: Palácio Guanabara - Rua Pinheiro Machado, s/n°, Laranjeiras, Rio de Janeiro."
74,06/11/2021 10:00,"Inauguração do II Centro de Equitação Terapêutica da PM.
Local: Avenida Marechal Fontenele, 2.906, Jardim Sulacap, Rio de Janeiro.Inauguração do II Centro de Equitação Terapêutica da PM.Local: Avenida Marechal Fontenele, 2.906, Jardim Sulacap, Rio de Janeiro."
75,06/11/2021 09:00,"Lançamento do Programa Bairro Seguro em São Cristóvão, Zona Norte do Rio. 
Local: Rua Campo de São Cristóvão, 122.Lançamento do Programa Bairro Seguro em São Cristóvão, Zona Norte do Rio. Local: Rua Campo de São Cristóvão, 122."
76,05/11/2021 10:00,"Ciclo de Eventos ""Construindo um Novo Estado do Rio"".
Local: Hotel Le Canton, Rua Antônio da Silva, 300 – Vargem Grande – Teresópolis.Ciclo de Eventos ""Construindo um Novo Estado do Rio"".Local: Hotel Le Canton, Rua Antônio da Silva, 300 – Vargem Grande – Teresópolis."
77,04/11/2021 12:00,"Visita ao Centro de Distribuição da Magalu em Duque de Caxias. 
Local: Centro Logístico de Distribuição da GLP, Xerém.Visita ao Centro de Distribuição da Magalu em Duque de Caxias. Local: Centro Logístico de Distribuição da GLP, Xerém."
78,04/11/2021 10:00,"Lançamento do Programa RJ para Todos 
Local: Palácio Guanabara - Rua Pinheiro Machado, s/n°, Laranjeiras, Rio de Janeiro.Lançamento do Programa RJ para Todos Local: Palácio Guanabara - Rua Pinheiro Machado, s/n°, Laranjeiras, Rio de Janeiro."
79,03/11/2021 08:00,"Despachos internos. 
Local: Palácio Laranjeiras - Rua Paulo César de Andrade, 407, Laranjeiras, Rio de Janeiro.Despachos internos. Local: Palácio Laranjeiras - Rua Paulo César de Andrade, 407, Laranjeiras, Rio de Janeiro."
80,01/11/2021 11:00,"Início da recuperação da Estação Elevatória de ParafusoLocal: Próximo ao Posto 5 - Avenida Atlântica, CopacabanaLocal: Próximo ao Posto 5 - Avenida Atlântica, Copacabana"
81,01/11/2021 09:00,"Início do programa Vem com a GenteLocal: Quadra da Mangueira - Rua Visconde de Niterói, 1.072Local: Quadra da Mangueira - Rua Visconde de Niterói, 1.072"
82,28/10/2021 10:00,"Anúncio do início das obras do Projeto Maraey. 
Local: Avenida Maysa, 5.300, Inoã, Maricá.Anúncio do início das obras do Projeto Maraey. Local: Avenida Maysa, 5.300, Inoã, Maricá."
83,27/10/2021 12:00,"Assinatura de mensagem legislativa para a fusão Uezo/Uerj. 
Local: Campus Maracanã da Uerj, na Rua São Francisco Xavier.Assinatura de mensagem legislativa para a fusão Uezo/Uerj. Local: Campus Maracanã da Uerj, na Rua São Francisco Xavier."
84,23/10/2021 11:30,"Inauguração da Faetec Vila Kennedy. 
Local: Rua João Barcellos Martins S/Nº - Vila Kennedy, Rio de Janeiro.Inauguração da Faetec Vila Kennedy. Local: Rua João Barcellos Martins S/Nº - Vila Kennedy, Rio de Janeiro."
85,21/10/2021 19:00,"Infra Brazil GRI 2021. 
Local: Rua Casa do Ator, 642, Vila Olímpia – São Paulo.Infra Brazil GRI 2021. Local: Rua Casa do Ator, 642, Vila Olímpia – São Paulo."
86,21/10/2021 16:00,"20° Fórum Empresarial Lide. 
Local: Hotel Grand Hyatt São Paulo, Avenida das Nações Unidas, 13.301, Itaim Bibi, São Paulo.20° Fórum Empresarial Lide. Local: Hotel Grand Hyatt São Paulo, Avenida das Nações Unidas, 13.301, Itaim Bibi, São Paulo."
87,21/10/2021 11:00,"Anúncio de investimentos da União Química no Rio de Janeiro.
 Local: Inovat - Avenida Presidente Tancredo de Almeida Neves, Guarulhos, São Paulo.Anúncio de investimentos da União Química no Rio de Janeiro. Local: Inovat - Avenida Presidente Tancredo de Almeida Neves, Guarulhos, São Paulo."
88,20/10/2021 09:00,Reuniões em Brasília.Reuniões em Brasília.
89,19/10/2021 09:00,"Despachos internos. 
Local: Palácio Guanabara - Rua Pinheiro Machado, s/n°, Laranjeiras, Rio de Janeiro.Despachos internos. Local: Palácio Guanabara - Rua Pinheiro Machado, s/n°, Laranjeiras, Rio de Janeiro."
90,18/10/2021 10:00,"Lançamento do Dossiê Mulher 2021. 
Local: Museu de Arte do Rio (MAR) – Praça Mauá, 5 – Centro.Lançamento do Dossiê Mulher 2021. Local: Museu de Arte do Rio (MAR) – Praça Mauá, 5 – Centro."
91,16/10/2021 09:00,Inauguração do programa Bairro Seguro em Santa TeresaLocal:Largo do Guimarães
92,15/10/2021 11:00,"Assinatura do protocolo de intenções para a construção do novo Fórum de Miguel Pereira. 
Local: Rua Dom Manuel, 37 - Centro do Rio (Tribunal de Justiça).Assinatura do protocolo de intenções para a construção do novo Fórum de Miguel Pereira. Local: Rua Dom Manuel, 37 - Centro do Rio (Tribunal de Justiça)."
93,15/10/2021 09:00,"Inauguração do Hospital Universitário Reitor Hesio Cordeiro. 
Local: Avenida Arizio Gomes da Costa, 186 - Cabo Frio.Inauguração do Hospital Universitário Reitor Hesio Cordeiro. Local: Avenida Arizio Gomes da Costa, 186 - Cabo Frio."
94,14/10/2021 16:00,"Reunião com vereadores e prefeito de Duque de Caxias, Washington Reis. Secretário de Polícia Civil, Allan Turnowski também participará. 
Local: Palácio Guanabara - Rua Pinheiro Machado, Laranjeiras.Reunião com vereadores e prefeito de Duque de Caxias, Washington Reis. Secretário de Polícia Civil, Allan Turnowski também participará. Local: Palácio Guanabara - Rua Pinheiro Machado, Laranjeiras."
95,14/10/2021 11:00,"Visita à empresa Águas do Rio. 
Local: Rua Barão de Tefé, 34, Saúde, Rio de Janeiro.Visita à empresa Águas do Rio. Local: Rua Barão de Tefé, 34, Saúde, Rio de Janeiro."
96,14/10/2021 10:00,"Inauguração da Central Reversa Logística de Eletrônicos. 
Local: Estrada da Água Branca, 1.160 - Realengo, Rio de Janeiro.Inauguração da Central Reversa Logística de Eletrônicos. Local: Estrada da Água Branca, 1.160 - Realengo, Rio de Janeiro."
97,13/10/2021 10:00,"Entrega de motocicletas para o programa Segurança Presente de Niterói. 
Local: Palácio Guanabara - Rua Pinheiro Machado, s/n°, Laranjeiras, Rio de Janeiro.Entrega de motocicletas para o programa Segurança Presente de Niterói. Local: Palácio Guanabara - Rua Pinheiro Machado, s/n°, Laranjeiras, Rio de Janeiro."
98,07/10/2021 10:00,"Congresso Smart City Expo Latam no México e encontro com o governador de Yucatán, Mauricio Vila Dosal.Congresso Smart City Expo Latam no México e encontro com o governador de Yucatán, Mauricio Vila Dosal."
99,06/10/2021 11:00,Viagem ao México.Viagem ao México.
